gxa_property_name	occurrences_in_contrasts	contrast_property_types	example_values	example_urls	example_accessions	current_handling_or_gap	candidate_inference_field
fibrosis stage	5	SAMPLE:5	METAVIR fibrosis score 3, METAVIR fibrosis score 4 vs METAVIR fibrosis score 0, METAVIR fibrosis score 1, METAVIR fibrosis score 2; METAVIR fibrosis score 3, METAVIR fibrosis score 4 vs METAVIR fibrosis score 0, METAVIR fibrosis score 1; METAVIR fibrosis score 3, METAVIR fibrosis score 4 vs METAVIR fibrosis score 1, METAVIR fibrosis score 2	https://www.ebi.ac.uk/gxa/experiments/E-MTAB-6863/Results; https://www.ebi.ac.uk/gxa/experiments/E-MTAB-6863/Results; https://www.ebi.ac.uk/gxa/experiments/E-MTAB-6863/Results	E-MTAB-6863; E-MTAB-6863; E-MTAB-6863	SAMPLE values are structured as sample.additionalProperty; FACTOR values are preserved in variableMeasured/measurementDenominator context.	sample.additionalProperty; variableMeasured.description; measurementDenominator.description
paired samples pre/post vitamin d supplementation	5	SAMPLE:5	yes vs no; no, yes vs no; no, yes vs yes	https://www.ebi.ac.uk/gxa/experiments/E-MTAB-9789/Results; https://www.ebi.ac.uk/gxa/experiments/E-MTAB-9789/Results; https://www.ebi.ac.uk/gxa/experiments/E-MTAB-9789/Results	E-MTAB-9789; E-MTAB-9789; E-MTAB-9789	SAMPLE values are structured as sample.additionalProperty; FACTOR values are preserved in variableMeasured/measurementDenominator context.	sample.additionalProperty; variableMeasured.description; measurementDenominator.description
rin	5	SAMPLE:5	9,4, 10 vs 9,7, 10; 9,7, 9,8, 10 vs 9,7, 10; 9,3, 9,8, 9,6 vs 9,7, 10	https://www.ebi.ac.uk/gxa/experiments/E-MTAB-9852/Results; https://www.ebi.ac.uk/gxa/experiments/E-MTAB-9852/Results; https://www.ebi.ac.uk/gxa/experiments/E-MTAB-9852/Results	E-MTAB-9852; E-MTAB-9852; E-MTAB-9852	SAMPLE values are structured as sample.additionalProperty; FACTOR values, when present, are preserved in condition context.	sample.additionalProperty; variableMeasured.description; measurementDenominator.description
sequencing depth	5	SAMPLE:5	64.67, 64.56, 64.43 vs 22.26, 22.19; 64.48, 64.72, 64.47 vs 22.17, 22.19, 22.2; 64.67, 64.56, 64.43 vs 64.48, 64.72, 64.47	https://www.ebi.ac.uk/gxa/experiments/E-CURD-37/Results; https://www.ebi.ac.uk/gxa/experiments/E-CURD-37/Results; https://www.ebi.ac.uk/gxa/experiments/E-CURD-37/Results	E-CURD-37; E-CURD-37; E-CURD-37	SAMPLE values are structured as sample.additionalProperty; FACTOR values, when present, are preserved in condition context.	sample.additionalProperty; variableMeasured.description; measurementDenominator.description
serum 25(oh)d after supplementation (nmol/l)	5	SAMPLE:5	, 152, 142, 131, 121, 155, 122, 133, 100, 166, 178, 147, 114, 115, 106, 128, 98; , 152, 131, 142, 121, 155, 166, 133, 100, 122, 178, 147, 114, 115, 128, 106, 98; , 152, 131, 142, 121, 155, 166, 133, 100, 122, 178, 147, 114, 115, 128, 106, 98 vs , 152, 142, 131, 121, 155, 122, 133, 100, 166, 178, 147, 114, 115, 106, 128, 98	https://www.ebi.ac.uk/gxa/experiments/E-MTAB-9789/Results; https://www.ebi.ac.uk/gxa/experiments/E-MTAB-9789/Results; https://www.ebi.ac.uk/gxa/experiments/E-MTAB-9789/Results	E-MTAB-9789; E-MTAB-9789; E-MTAB-9789	SAMPLE values are structured as sample.additionalProperty; FACTOR values, when present, are preserved in condition context.	sample.additionalProperty; variableMeasured.description; measurementDenominator.description
serum 25(oh)d before supplementation (nmol/l)	5	SAMPLE:5	, 22, 44, 23, 68, 46, 24, 49, 27, 133, 116, 71, 50, 51, 52, 53, 98, 32, 76, 55, 99, 36, 37, 59, 105, 40, 42, 65 vs 88, 78, 35, 49, 29; 44, , 22, 23, 46, 24, 68, 49, 27, 133, 116, 71, 50, 51, 52, 53, 32, 98, 76, 55, 99, 57, 36, 37, 59, 125, 105, 40, 85, 42, 65 vs , 88, 78, 35, 59, 49, 29; 44, , 22, 23, 46, 24, 68, 49, 27, 133, 116, 71, 50, 51, 52, 53, 32, 98, 76, 55, 99, 57, 36, 37, 59, 125, 105, 40, 85, 42, 65 vs , 22, 44, 23, 68, 46, 24, 49, 27, 133, 116, 71, 50, 51, 52, 53, 98, 32, 76, 55, 99, 36, 37, 59, 105, 40, 42, 65	https://www.ebi.ac.uk/gxa/experiments/E-MTAB-9789/Results; https://www.ebi.ac.uk/gxa/experiments/E-MTAB-9789/Results; https://www.ebi.ac.uk/gxa/experiments/E-MTAB-9789/Results	E-MTAB-9789; E-MTAB-9789; E-MTAB-9789	SAMPLE values are structured as sample.additionalProperty; FACTOR values, when present, are preserved in condition context.	sample.additionalProperty; variableMeasured.description; measurementDenominator.description
smoker	5	SAMPLE:5	current smoker, non smoker, ex-smoker vs not available, non smoker, ex-smoker, current smoker; not available, current smoker, ex-smoker vs not available, current smoker, non smoker; not available, non smoker, ex-smoker, current smoker vs not available, current smoker, ex-smoker	https://www.ebi.ac.uk/gxa/experiments/E-MTAB-6863/Results; https://www.ebi.ac.uk/gxa/experiments/E-MTAB-6863/Results; https://www.ebi.ac.uk/gxa/experiments/E-MTAB-6863/Results	E-MTAB-6863; E-MTAB-6863; E-MTAB-6863	SAMPLE values are structured as sample.additionalProperty; FACTOR values are preserved in variableMeasured/measurementDenominator context.	sample.additionalProperty; variableMeasured.description; measurementDenominator.description
strain or line	5	SAMPLE:5	no explicit value in contrast JSON; no explicit value in contrast JSON; no explicit value in contrast JSON	https://www.ebi.ac.uk/gxa/experiments/E-MEXP-2089/Results; https://www.ebi.ac.uk/gxa/experiments/E-MEXP-27/Results; https://www.ebi.ac.uk/gxa/experiments/E-MEXP-27/Results	E-MEXP-2089; E-MEXP-27; E-MEXP-27	FACTOR values are preserved in condition context; SAMPLE values are structured as sample.additionalProperty.	variableMeasured.description; measurementDenominator.description; sample.additionalProperty
development stage	4	SAMPLE:4	15 days post anthesis vs 15 days post anthesis; stage R5, beginning seed vs stage R5, beginning seed	https://www.ebi.ac.uk/gxa/experiments/E-MTAB-4819/Results; https://www.ebi.ac.uk/gxa/experiments/E-MTAB-5076/Results	E-MTAB-4819; E-MTAB-5076	Variant label normalized to developmental stage for crawler matching.	sample.developmentalStage.name
duration of experiment	4	SAMPLE:4	0.5 week vs 0.5 week; 12 week vs 12 week	https://www.ebi.ac.uk/gxa/experiments/E-MTAB-9864/Results; https://www.ebi.ac.uk/gxa/experiments/E-MTAB-9864/Results	E-MTAB-9864; E-MTAB-9864	FACTOR values are preserved in variableMeasured/measurementDenominator context; SAMPLE values are structured as sample.additionalProperty. observationPeriod remains a possible future refinement.	variableMeasured.description; measurementDenominator.description; sample.additionalProperty; observationPeriod.name
group	4	SAMPLE:4	KI_0h vs WT_0h; KI_12h vs WT_12h; KI_24h vs WT_24h	https://www.ebi.ac.uk/gxa/experiments/E-MTAB-10104/Results; https://www.ebi.ac.uk/gxa/experiments/E-MTAB-10104/Results; https://www.ebi.ac.uk/gxa/experiments/E-MTAB-10104/Results	E-MTAB-10104; E-MTAB-10104; E-MTAB-10104	SAMPLE values are structured as sample.additionalProperty; FACTOR values, when present, are preserved in condition context.	sample.additionalProperty; variableMeasured.description; measurementDenominator.description
material type	4	FACTOR:3; SAMPLE:1	thick deformable vs thick deformable; individual plant vs individual plant	https://www.ebi.ac.uk/gxa/experiments/E-GEOD-23764/Results; https://www.ebi.ac.uk/gxa/experiments/E-GEOD-43560/Results	E-GEOD-23764; E-GEOD-43560	FACTOR values are preserved in condition context; SAMPLE values are structured as sample.additionalProperty.	variableMeasured.description; measurementDenominator.description; sample.additionalProperty
medium donor	4	SAMPLE:4	P1; P1 vs P1	https://www.ebi.ac.uk/gxa/experiments/E-MTAB-7472/Results; https://www.ebi.ac.uk/gxa/experiments/E-MTAB-7472/Results	E-MTAB-7472; E-MTAB-7472	FACTOR values are preserved in condition context; SAMPLE values are structured as sample.additionalProperty.	variableMeasured.description; measurementDenominator.description; sample.additionalProperty
rna interference	4	FACTOR:4	miR-30a-3p siRNA duplex vs none; TIA-1 and TIAR siRNA vs control siRNA; TIA-1 siRNA vs control siRNA	https://www.ebi.ac.uk/gxa/experiments/E-MEXP-456/Results; https://www.ebi.ac.uk/gxa/experiments/E-MTAB-93/Results; https://www.ebi.ac.uk/gxa/experiments/E-MTAB-93/Results	E-MEXP-456; E-MTAB-93; E-MTAB-93	FACTOR values are preserved in condition context; SAMPLE values are structured as sample.additionalProperty.	variableMeasured.description; measurementDenominator.description; sample.additionalProperty
sample included in analysis	4	SAMPLE:4	sample OK, sample rejected vs sample OK, sample rejected	https://www.ebi.ac.uk/gxa/experiments/E-GEOD-21374/Results	E-GEOD-21374	FACTOR values are preserved in condition context; SAMPLE values are structured as sample.additionalProperty.	variableMeasured.description; measurementDenominator.description; sample.additionalProperty
survival time	4	FACTOR:3; SAMPLE:1	long vs short; 28 month, 23 month, 6 month, 9 month, 7 month, 15 month, 25 month, 52 month, 17 month, 22 month, 12 month, 19 month, 29 month, 30 month, 10 month, 24 month, 5 month, 14 month, 8 month, 59 month, 36 month, 11 month, 16 month, 26 month, 3 month, 46 month, 56 month vs 23 month, 4 month, 33 month, 9 month, 24 month, 5 month, 14 month, 1 month, 7 month, 8 month, 15 month, 11 month, 16 month, 26 month	https://www.ebi.ac.uk/gxa/experiments/E-GEOD-28571/Results; https://www.ebi.ac.uk/gxa/experiments/E-GEOD-7696/Results	E-GEOD-28571; E-GEOD-7696	FACTOR values are preserved in variableMeasured/measurementDenominator context; SAMPLE values are structured as sample.additionalProperty. observationPeriod remains a possible future refinement.	variableMeasured.description; measurementDenominator.description; sample.additionalProperty; observationPeriod.name
time from biopsy to failure/censoring days	4	SAMPLE:4	192, 175, 155, 375, 254, 650, 596, 476, 731, 577, 776, 90, 216, 777, 75, 10, 141, 321, 168, 146, 642, 225, 105, 127, 623, 469, 8, 81, 229, 902 vs 907, 1185, 1581, 1182, 1181, 592, 353, 1612, 595, 113, 477, 873, 1179, 1696, 1454, 511, 1574, 633, 1331, 636, 638, 639, 1110, 1076, 1590, 361, 362, 1503, 1502, 1106, 881, 882, 762, 884, 643, 1068, 766, 524, 887, 768, 802, 527, 1505, 928, 22, 1084, 1480, 492, 494, 650, 1359, 652, 773, 411, 1355, 1234, 1475, 259, 1112, 777, 1078, 656, 811, 658, 779, 659, 936, 817, 819, 39, 1011, 1374, 1251, 1097, 1491, 142, 144, 421, 543, 664, 1124, 820, 545, 1244, 700, 547, 702, 427, 669, 945, 307, 704, 827, 1022, 1143, 392, 1414, 551, 310, 1138, 399, 1258, 951, 797, 1531, 435, 1497, 1254, 1650, 712, 833, 52, 1550, 1152, 1393, 1030, 282, 680, 442, 1302, 1148, 323, 566, 844, 965, 967, 209, 727, 606, 1440, 1560, 1283, 693, 694, 453, 1435, 454, 575, 697, 698, 1036, 1035, 1277, 1430, 579, 1276, 854, 613, 979, 79, 1176, 1051, 1171, 1170, 583, 1602, 1206, 981, 1323, 466, 104, 1167, 746, 109, 508, 905, 1603; 15, 171, 273, 264, 364, 298, 464, 585, 322, 740, 246, 357, 456, 413, 237, 226, 502, 238, 1045, 954, 658 vs 590, 670, 197, 1216, 673, 630, 1411, 1410, 599, 557, 437, 516, 837, 719, 1154, 1153, 2, 1588, 1389, 523, 605, 606, 1165, 1440, 1240, 1360, 697, 379, 775, 1156, 655, 811, 659, 539, 1439, 1559, 1093, 581, 1327, 341, 463, 1367, 741, 1322, 1002, 1288, 1243, 546, 1441, 701, 901, 507, 708; 590, 670, 197, 1216, 673, 630, 1411, 1410, 599, 557, 437, 516, 837, 719, 1154, 1153, 2, 1588, 1389, 523, 605, 606, 1165, 1440, 1240, 1360, 697, 379, 775, 1156, 655, 811, 659, 539, 1439, 1559, 1093, 581, 1327, 341, 463, 1367, 741, 1322, 1002, 1288, 1243, 546, 1441, 701, 901, 507, 708 vs 907, 1185, 1581, 1182, 1181, 592, 353, 1612, 595, 113, 477, 873, 1179, 1696, 1454, 511, 1574, 633, 1331, 636, 638, 639, 1110, 1076, 1590, 361, 362, 1503, 1502, 1106, 881, 882, 762, 884, 643, 1068, 766, 524, 887, 768, 802, 527, 1505, 928, 22, 1084, 1480, 492, 494, 650, 1359, 652, 773, 411, 1355, 1234, 1475, 259, 1112, 777, 1078, 656, 811, 658, 779, 659, 936, 817, 819, 39, 1011, 1374, 1251, 1097, 1491, 142, 144, 421, 543, 664, 1124, 820, 545, 1244, 700, 547, 702, 427, 669, 945, 307, 704, 827, 1022, 1143, 392, 1414, 551, 310, 1138, 399, 1258, 951, 797, 1531, 435, 1497, 1254, 1650, 712, 833, 52, 1550, 1152, 1393, 1030, 282, 680, 442, 1302, 1148, 323, 566, 844, 965, 967, 209, 727, 606, 1440, 1560, 1283, 693, 694, 453, 1435, 454, 575, 697, 698, 1036, 1035, 1277, 1430, 579, 1276, 854, 613, 979, 79, 1176, 1051, 1171, 1170, 583, 1602, 1206, 981, 1323, 466, 104, 1167, 746, 109, 508, 905, 1603	https://www.ebi.ac.uk/gxa/experiments/E-GEOD-21374/Results; https://www.ebi.ac.uk/gxa/experiments/E-GEOD-21374/Results; https://www.ebi.ac.uk/gxa/experiments/E-GEOD-21374/Results	E-GEOD-21374; E-GEOD-21374; E-GEOD-21374	FACTOR values are preserved in variableMeasured/measurementDenominator context; SAMPLE values are structured as sample.additionalProperty. observationPeriod remains a possible future refinement.	variableMeasured.description; measurementDenominator.description; sample.additionalProperty; observationPeriod.name
RNA integrity number	3	SAMPLE:3	8.6, 7.7, 9.5, 7.8, 8.7, 6.9, 9.6, 8.8, 7.9, 9.7, 8.9, 9.8, 10, 1, 8, 9, 6.1, 7.1, 6.2, 8.1, 7.2, 9.1, 8.2, 7.3, 6.4, 8.3, 9.2, 7.4, 9.3, 7.5, 8.4, 9.4, 8.5, 7.6, 4.9 vs 8.6, 7.7, 6.8, 9.5, 7.8, 6.9, 8.7, 9.6, 8.8, 7.9, 9.7, 8.9, 9.8, 10, 1, 7, 8, 9, 7.1, 7.2, 8.1, 6.3, 8.2, 7.3, 9.1, 9.2, 8.3, 7.4, 8.4, 9.3, 7.5, 6.6, 7.6, 8.5, 9.4; 8.6, 7.7, 9.5, 7.8, 8.7, 6.9, 9.6, 8.8, 7.9, 9.7, 8.9, 9.8, 10, 1, 8, 9, 6.1, 7.1, 6.2, 8.1, 7.2, 9.1, 8.2, 7.3, 6.4, 8.3, 9.2, 7.4, 9.3, 7.5, 8.4, 9.4, 8.5, 7.6, 4.9 vs 9.5, 8.6, 6.8, 8.7, 7.8, 8.8, 7.9, 8.9, 8, 9, 8.1, 7.2, 8.2, 9.1, 7.3, 9.2, 8.3, 7.4, 8.4, 9.3, 7.5, 8.5, 9.4, 10; 8.6, 7.7, 6.8, 9.5, 7.8, 6.9, 8.7, 9.6, 8.8, 7.9, 9.7, 8.9, 9.8, 10, 1, 7, 8, 9, 7.1, 7.2, 8.1, 6.3, 8.2, 7.3, 9.1, 9.2, 8.3, 7.4, 8.4, 9.3, 7.5, 6.6, 7.6, 8.5, 9.4 vs 9.5, 8.6, 6.8, 8.7, 7.8, 8.8, 7.9, 8.9, 8, 9, 8.1, 7.2, 8.2, 9.1, 7.3, 9.2, 8.3, 7.4, 8.4, 9.3, 7.5, 8.5, 9.4, 10	https://www.ebi.ac.uk/gxa/experiments/E-GEOD-102008/Results; https://www.ebi.ac.uk/gxa/experiments/E-GEOD-102008/Results; https://www.ebi.ac.uk/gxa/experiments/E-GEOD-102008/Results	E-GEOD-102008; E-GEOD-102008; E-GEOD-102008	SAMPLE values are structured as sample.additionalProperty; FACTOR values, when present, are preserved in condition context.	sample.additionalProperty; variableMeasured.description; measurementDenominator.description
age at onset	3	SAMPLE:3	age at onset 11 years, age at onset 21 years, age at onset 7 years, age at onset 13 years, age at onset 48 years, age at onset 23 years, age at onset 9 years, age at onset 28 years, age at onset 44 years, age at onset 38 years, age at onset 18 years, age at onset 4 years, age at onset 25 years, age at onset 35 years, age at onset 15 years, not available, age at onset 6 years, age at onset 45 years, age at onset 22 years, age at onset 32 years, age at onset 42 years, age at onset 75 years, age at onset 40 years, age at onset 50 years, age at onset 12 years, age at onset 8 years, age at onset 30 years, age at onset 1 years, age at onset 57 years, age at onset 17 years, age at onset 47 years, age at onset 10 years, age at onset 3 years, age at onset 19 years, age at onset 20 years, age at onset 14 years, age at onset 34 years, age at onset 43 years, age at onset 33 years, age at onset 39 years, age at onset 5 years, age at onset 51 years, age at onset 41 years, age at onset 26 years, age at onset 2 years, age at onset 16 years vs not applicable; not applicable vs not applicable	https://www.ebi.ac.uk/gxa/experiments/E-GEOD-102008/Results; https://www.ebi.ac.uk/gxa/experiments/E-GEOD-102008/Results	E-GEOD-102008; E-GEOD-102008	FACTOR values are preserved in condition context; SAMPLE values are structured as sample.additionalProperty.	variableMeasured.description; measurementDenominator.description; sample.additionalProperty
biosourceprovider	3	SAMPLE:3	breast tumors were excised from women at the Rene Huguenin Hospital (Saint-Cloud, France) from 1978 to 2008 vs breast tumors were excised from women at the Rene Huguenin Hospital (Saint-Cloud, France) from 1978 to 2008; Charles River vs Charles River; The Scripps Research Institute, La Jolla, California, USA vs The Scripps Research Institute, La Jolla, California, USA	https://www.ebi.ac.uk/gxa/experiments/E-GEOD-22035/Results; https://www.ebi.ac.uk/gxa/experiments/E-GEOD-25515/Results; https://www.ebi.ac.uk/gxa/experiments/E-MTAB-698/Results	E-GEOD-22035; E-GEOD-25515; E-MTAB-698	SAMPLE values are structured as sample.additionalProperty; FACTOR values, when present, are preserved in condition context.	sample.additionalProperty; variableMeasured.description; measurementDenominator.description
bmi	3	SAMPLE:3	BMI more than 30 vs BMI less than 25; 26.1, 28, 29.6, 28.6, 27.6, 28.4, 27.1, 30.9 vs 26.1, 28, 29.6, 28.6, 27.6, 28.4, 30.9, 27.1; 26.8, 26.7, 28.4, 29.3, 27.5, 29.2, 27.3, 29.1 vs 26.8, 26.7, 28.4, 27.5, 29.3, 29.2, 27.3, 29.1	https://www.ebi.ac.uk/gxa/experiments/E-GEOD-44000/Results; https://www.ebi.ac.uk/gxa/experiments/E-TABM-740/Results; https://www.ebi.ac.uk/gxa/experiments/E-TABM-740/Results	E-GEOD-44000; E-TABM-740; E-TABM-740	FACTOR values are preserved in condition context; SAMPLE values are structured as sample.additionalProperty.	variableMeasured.description; measurementDenominator.description; sample.additionalProperty
developmentalstage	3	SAMPLE:3	3rd instar larva vs 3rd instar larva; adult vs adult	https://www.ebi.ac.uk/gxa/experiments/E-MTAB-1066/Results; https://www.ebi.ac.uk/gxa/experiments/E-MTAB-698/Results	E-MTAB-1066; E-MTAB-698	Variant spelling normalized to developmental stage for crawler matching.	sample.developmentalStage.name
disease duration	3	SAMPLE:3	disease duration 49 years, disease duration 52 years, disease duration 29 years, disease duration 39 years, disease duration 32 years, disease duration 7 years, disease duration 22 years, disease duration 12 years, disease duration 16 years, disease duration 26 years, disease duration 36 years, disease duration 46 years, disease duration 55 years, disease duration 4 years, disease duration 13 years, disease duration 43 years, disease duration 23 years, disease duration 25 years, disease duration 51 years, disease duration 11 years, disease duration 31 years, disease duration 8 years, disease duration 17 years, disease duration 37 years, disease duration 57 years, disease duration 34 years, disease duration 14 years, disease duration 24 years, disease duration 5 years, disease duration 2 years, disease duration 30 years, disease duration 20 years, disease duration 38 years, disease duration 1 years, not available, disease duration 10 years, disease duration 18 years, disease duration 9 years, disease duration 28 years, disease duration 33 years, disease duration 6 years, disease duration 15 years, disease duration 35 years, disease duration 41 years, disease duration 27 years, disease duration 3 years, disease duration 21 years, disease duration 19 years, disease duration 44 years, disease duration 0 years vs not applicable; not applicable vs not applicable	https://www.ebi.ac.uk/gxa/experiments/E-GEOD-102008/Results; https://www.ebi.ac.uk/gxa/experiments/E-GEOD-102008/Results	E-GEOD-102008; E-GEOD-102008	SAMPLE values are structured as sample.additionalProperty; FACTOR values are preserved in variableMeasured/measurementDenominator context.	sample.additionalProperty; variableMeasured.description; measurementDenominator.description
fds score	3	SAMPLE:3	FDS score 5, FDS score 6, FDS score 2.5, FDS score 3, FDS score 4, FDS score 3.5, FDS score 4.5, FDS score 1, FDS score 5.5, FDS score 2, not available, FDS score 1.5 vs not applicable; not applicable vs not applicable	https://www.ebi.ac.uk/gxa/experiments/E-GEOD-102008/Results; https://www.ebi.ac.uk/gxa/experiments/E-GEOD-102008/Results	E-GEOD-102008; E-GEOD-102008	SAMPLE values are structured as sample.additionalProperty; FACTOR values are preserved in variableMeasured/measurementDenominator context.	sample.additionalProperty; variableMeasured.description; measurementDenominator.description
